[
 {
  "pi": "Henry Corrigan-Gibbs",
  "students": [
   {
    "name": "Alexandra Henzinger",
    "role": "phd",
    "years": [
     2023,
     2025
    ],
    "url": "https://people.csail.mit.edu/henrycg/",
    "capture_url": "https://web.archive.org/web/20230313163025id_/https://people.csail.mit.edu/henrycg/",
    "sha256": "a27f2692e44e318304ec6851c41e18304f0e65d4bd46d25708bef4f3b85c6785",
    "quote": "students PhD students: Alexandra Henzinger",
    "note": "already held; new source. PhD student on the MIT-hosted home page (2023-03 through 2025-12 captures)"
   },
   {
    "name": "Ryan Lehmkuhl",
    "role": "phd",
    "years": [
     2023,
     2025
    ],
    "url": "https://people.csail.mit.edu/henrycg/",
    "capture_url": "https://web.archive.org/web/20230313163025id_/https://people.csail.mit.edu/henrycg/",
    "sha256": "a27f2692e44e318304ec6851c41e18304f0e65d4bd46d25708bef4f3b85c6785",
    "quote": "students PhD students: Alexandra Henzinger Ryan Lehmkuhl",
    "note": "already held; new source. PhD student on the MIT-hosted home page (2023-03 through 2025-12 captures)"
   },
   {
    "name": "Emma Dauterman",
    "role": "postdoc",
    "years": [
     2025,
     2025
    ],
    "url": "https://people.csail.mit.edu/henrycg/",
    "capture_url": "https://web.archive.org/web/20250415163153id_/https://people.csail.mit.edu/henrycg/",
    "sha256": "3ea5e2da8e600067870b1f77a37ccaa7751d1db340db66d552ea2fcdea205c56",
    "quote": "Postdocs: Emma Dauterman",
    "note": "postdoc on the MIT-hosted home page (2025-04 capture); later listed under past postdocs"
   },
   {
    "name": "Julia Len",
    "role": "postdoc",
    "years": [
     2025,
     2025
    ],
    "url": "https://people.csail.mit.edu/henrycg/",
    "capture_url": "https://web.archive.org/web/20250415163153id_/https://people.csail.mit.edu/henrycg/",
    "sha256": "3ea5e2da8e600067870b1f77a37ccaa7751d1db340db66d552ea2fcdea205c56",
    "quote": "students Postdocs: Emma Dauterman Julia Len",
    "note": "postdoc on the MIT-hosted home page (2025-04 capture); later listed under past postdocs"
   },
   {
    "name": "Kevin Liao",
    "role": "other",
    "years": null,
    "url": "https://people.csail.mit.edu/henrycg/alums/",
    "capture_url": "https://web.archive.org/web/20251014125502id_/https://people.csail.mit.edu/henrycg/alums/",
    "sha256": "e020930c2583024fed3b98f8f6045d5a601e971db040f846eeee52f171db4fec",
    "quote": "Past students and researchers For current researchers, see my home page postdocs Emma Dauterman → Assistant professor, Stanford Julia Len → Assistant professor, UNC Chapel Hill ms/ph.d Kevin Liao → PhD student, Internet Policy Research Initiative",
    "note": "listed under 'ms/ph.d' on the MIT-hosted past-students page (degree not stated); now a PhD student at MIT IPRI"
   },
   {
    "name": "Katarina Cheng",
    "role": "undergraduate",
    "years": [
     2023,
     2025
    ],
    "url": "https://people.csail.mit.edu/henrycg/alums/",
    "capture_url": "https://web.archive.org/web/20251014125502id_/https://people.csail.mit.edu/henrycg/alums/",
    "sha256": "e020930c2583024fed3b98f8f6045d5a601e971db040f846eeee52f171db4fec",
    "quote": "Past students and researchers For current researchers, see my home page postdocs Emma Dauterman → Assistant professor, Stanford Julia Len → Assistant professor, UNC Chapel Hill ms/ph.d Kevin Liao → PhD student, Internet Policy Research Initiative undergrads Katarina Cheng (Fall 2023–Spring 2025)"
   },
   {
    "name": "Megha Hegde",
    "role": "undergraduate",
    "years": [
     2025,
     2025
    ],
    "url": "https://people.csail.mit.edu/henrycg/alums/",
    "capture_url": "https://web.archive.org/web/20251014125502id_/https://people.csail.mit.edu/henrycg/alums/",
    "sha256": "e020930c2583024fed3b98f8f6045d5a601e971db040f846eeee52f171db4fec",
    "quote": "Past students and researchers For current researchers, see my home page postdocs Emma Dauterman → Assistant professor, Stanford Julia Len → Assistant professor, UNC Chapel Hill ms/ph.d Kevin Liao → PhD student, Internet Policy Research Initiative undergrads Katarina Cheng (Fall 2023–Spring 2025) → PhD student, UW Megha Hegde (IAP 2025)"
   },
   {
    "name": "Togzhan Shyntay",
    "role": "undergraduate",
    "years": [
     2024,
     2024
    ],
    "url": "https://people.csail.mit.edu/henrycg/alums/",
    "capture_url": "https://web.archive.org/web/20251014125502id_/https://people.csail.mit.edu/henrycg/alums/",
    "sha256": "e020930c2583024fed3b98f8f6045d5a601e971db040f846eeee52f171db4fec",
    "quote": "Past students and researchers For current researchers, see my home page postdocs Emma Dauterman → Assistant professor, Stanford Julia Len → Assistant professor, UNC Chapel Hill ms/ph.d Kevin Liao → PhD student, Internet Policy Research Initiative undergrads Katarina Cheng (Fall 2023–Spring 2025) → PhD student, UW Megha Hegde (IAP 2025) Togzhan Shyntay (Summer 2024)"
   },
   {
    "name": "Serena Li",
    "role": "undergraduate",
    "years": [
     2024,
     2024
    ],
    "url": "https://people.csail.mit.edu/henrycg/alums/",
    "capture_url": "https://web.archive.org/web/20251014125502id_/https://people.csail.mit.edu/henrycg/alums/",
    "sha256": "e020930c2583024fed3b98f8f6045d5a601e971db040f846eeee52f171db4fec",
    "quote": "Past students and researchers For current researchers, see my home page postdocs Emma Dauterman → Assistant professor, Stanford Julia Len → Assistant professor, UNC Chapel Hill ms/ph.d Kevin Liao → PhD student, Internet Policy Research Initiative undergrads Katarina Cheng (Fall 2023–Spring 2025) → PhD student, UW Megha Hegde (IAP 2025) Togzhan Shyntay (Summer 2024) Serena Li (Spring 2024)"
   },
   {
    "name": "Amy He",
    "role": "undergraduate",
    "years": [
     2023,
     2024
    ],
    "url": "https://people.csail.mit.edu/henrycg/alums/",
    "capture_url": "https://web.archive.org/web/20251014125502id_/https://people.csail.mit.edu/henrycg/alums/",
    "sha256": "e020930c2583024fed3b98f8f6045d5a601e971db040f846eeee52f171db4fec",
    "quote": "Past students and researchers For current researchers, see my home page postdocs Emma Dauterman → Assistant professor, Stanford Julia Len → Assistant professor, UNC Chapel Hill ms/ph.d Kevin Liao → PhD student, Internet Policy Research Initiative undergrads Katarina Cheng (Fall 2023–Spring 2025) → PhD student, UW Megha Hegde (IAP 2025) Togzhan Shyntay (Summer 2024) Serena Li (Spring 2024) Amy He (Fall 2023, Spring 2024)"
   },
   {
    "name": "Arvid Lunnemark",
    "role": "undergraduate",
    "years": [
     2021,
     2022
    ],
    "url": "https://people.csail.mit.edu/henrycg/alums/",
    "capture_url": "https://web.archive.org/web/20251014125502id_/https://people.csail.mit.edu/henrycg/alums/",
    "sha256": "e020930c2583024fed3b98f8f6045d5a601e971db040f846eeee52f171db4fec",
    "quote": "Past students and researchers For current researchers, see my home page postdocs Emma Dauterman → Assistant professor, Stanford Julia Len → Assistant professor, UNC Chapel Hill ms/ph.d Kevin Liao → PhD student, Internet Policy Research Initiative undergrads Katarina Cheng (Fall 2023–Spring 2025) → PhD student, UW Megha Hegde (IAP 2025) Togzhan Shyntay (Summer 2024) Serena Li (Spring 2024) Amy He (Fall 2023, Spring 2024) Arvid Lunnemark (Fall 2021–Spring 2022)"
   },
   {
    "name": "Rene Reyes",
    "role": "undergraduate",
    "years": [
     2021,
     2021
    ],
    "url": "https://people.csail.mit.edu/henrycg/alums/",
    "capture_url": "https://web.archive.org/web/20251014125502id_/https://people.csail.mit.edu/henrycg/alums/",
    "sha256": "e020930c2583024fed3b98f8f6045d5a601e971db040f846eeee52f171db4fec",
    "quote": "Past students and researchers For current researchers, see my home page postdocs Emma Dauterman → Assistant professor, Stanford Julia Len → Assistant professor, UNC Chapel Hill ms/ph.d Kevin Liao → PhD student, Internet Policy Research Initiative undergrads Katarina Cheng (Fall 2023–Spring 2025) → PhD student, UW Megha Hegde (IAP 2025) Togzhan Shyntay (Summer 2024) Serena Li (Spring 2024) Amy He (Fall 2023, Spring 2024) Arvid Lunnemark (Fall 2021–Spring 2022) → Co-founder, Anysphere/Cursor Rene Reyes (Spring 2021)"
   }
  ],
  "lab_note": "Security/cryptography group in CSAIL (PDOS/CSS) 2020-2025. Corrigan-Gibbs moved to UC Berkeley EECS in January 2026: people.csail.mit.edu/henrycg/ now redirects to people.eecs.berkeley.edu/~henrycg/. All rows here come from MIT-hosted Wayback captures (home page 2023-03, 2025-04; past-students page 2025-10).",
  "notes": "Sources: Wayback captures of people.csail.mit.edu/henrycg/ (students section) and /alums/; DSpace@MIT advisor search (Henzinger SM 2022, Lehmkuhl SM 2024, both already held). Excluded: Shinwon Lee (current student on the Berkeley page only), visitor Inès Bichon (Spring 2026, Berkeley)."
 },
 {
  "pi": "Sam Hopkins",
  "students": [
   {
    "name": "Prashanti Anderson",
    "role": "phd",
    "years": [
     2026,
     2026
    ],
    "url": "https://www.samuelbhopkins.com/",
    "sha256": "0eaf3272b9440a2c38e587aa240aa99f6f90e231a66a365b917a3d8c1d7dc2bd",
    "quote": "My group: Current: Prashanti Anderson (PhD)",
    "note": "current group member on the PI's home page (2026)"
   },
   {
    "name": "Amit Rajaraman",
    "role": "phd",
    "years": [
     2026,
     2026
    ],
    "url": "https://www.samuelbhopkins.com/",
    "sha256": "0eaf3272b9440a2c38e587aa240aa99f6f90e231a66a365b917a3d8c1d7dc2bd",
    "quote": "My group: Current: Prashanti Anderson (PhD) Amit Rajaraman (PhD)",
    "note": "already held; new source. current group member on the PI's home page (2026)"
   },
   {
    "name": "Ittai Rubinstein",
    "role": "phd",
    "years": [
     2026,
     2026
    ],
    "url": "https://www.samuelbhopkins.com/",
    "sha256": "0eaf3272b9440a2c38e587aa240aa99f6f90e231a66a365b917a3d8c1d7dc2bd",